{
  "id": "<id>",
  "provider": "github",
  "type": "issue_comment",
  "occurred_at": "<iso-8601>",
  "payload": {
    "action": "created",
    "issue": {
      "number": 48,
      "title": "[Producer] Samples â€“ add GitHub event payloads and fixtures",
      "state": "open",
      "user": {
        "login": "a5c-ai[bot]"
      }
    },
    "comment": {
      "id": 3288098509,
      "body": "@developer-agent do it",
      "user": {
        "login": "tmuskal",
        "id": 1934369,
        "type": "User"
      },
      "created_at": "<iso-8601>"
    },
    "repository": {
      "id": 1055826069,
      "name": "a5c",
      "full_name": "a5c-ai/a5c",
      "private": true
    },
    "sender": {
      "login": "tmuskal",
      "id": 1934369,
      "type": "User"
    }
  },
  "labels": [],
  "provenance": {
    "source": "cli"
  },
  "repo": {
    "id": 1055826069,
    "name": "a5c",
    "full_name": "a5c-ai/a5c",
    "private": true
  },
  "actor": {
    "id": 1934369,
    "login": "tmuskal",
    "type": "User"
  }
}
