{
  "id": "62",
  "provider": "github",
  "type": "pull_request",
  "occurred_at": "2025-09-19T10:47:11.499Z",
  "repo": {
    "id": 1055826069,
    "name": "events",
    "full_name": "a5c-ai/events",
    "private": true,
    "visibility": null
  },
  "ref": {
    "name": "feat/samples-fixtures-issue48",
    "type": "branch",
    "base": "a5c/main",
    "head": "feat/samples-fixtures-issue48"
  },
  "actor": {
    "id": 1934369,
    "login": "tmuskal",
    "type": "User"
  },
  "payload": {
    "action": "synchronize",
    "number": 62,
    "pull_request": {
      "number": 62,
      "state": "open",
      "title": "ðŸ§ª Samples and fixtures for GitHub events (issue #48)",
      "draft": true,
      "mergeable_state": "dirty",
      "base": {
        "ref": "a5c/main",
        "sha": "bbbbbbbbbbbbbbbbbbbbbbbbbbbbbbbbbbbbbbbb"
      },
      "head": {
        "ref": "feat/samples-fixtures-issue48",
        "sha": "cccccccccccccccccccccccccccccccccccccccc"
      },
      "labels": [
        {
          "name": "documentation"
        },
        {
          "name": "producer"
        },
        {
          "name": "testing"
        }
      ],
      "user": {
        "login": "developer-agent",
        "type": "Bot"
      },
      "html_url": "https://github.com/a5c-ai/events/pull/62"
    },
    "repository": {
      "id": 1055826069,
      "name": "events",
      "full_name": "a5c-ai/events",
      "private": true
    },
    "sender": {
      "login": "tmuskal",
      "type": "User",
      "id": 1934369
    }
  },
  "labels": [],
  "provenance": {
    "source": "cli"
  },
  "enriched": {
    "github": {
      "provider": "github",
      "partial": true,
      "reason": "flag:not_set"
    },
    "metadata": {},
    "derived": {
      "flags": {}
    }
  }
}
