{
  "id": "<id>",
  "provider": "github",
  "type": "workflow_run",
  "occurred_at": "<iso-8601>",
  "payload": {
    "action": "completed",
    "workflow_run": {
      "id": 1234567890,
      "name": "Build",
      "run_number": 42,
      "run_attempt": 1,
      "event": "push",
      "status": "completed",
      "conclusion": "success",
      "head_branch": "a5c/main",
      "head_sha": "<sha>",
      "pull_requests": [],
      "created_at": "<iso-8601>",
      "updated_at": "<iso-8601>",
      "html_url": "https://github.com/a5c-ai/a5c/actions/runs/1234567890",
      "url": "https://api.github.com/repos/a5c-ai/a5c/actions/runs/1234567890",
      "repository": {
        "id": 1055826069,
        "name": "a5c",
        "full_name": "a5c-ai/a5c",
        "private": true
      }
    },
    "repository": {
      "id": 1055826069,
      "name": "a5c",
      "full_name": "a5c-ai/a5c",
      "private": true,
      "default_branch": "a5c/main"
    },
    "sender": {
      "id": 221166651,
      "login": "a5c-ai[bot]",
      "type": "Bot"
    }
  },
  "labels": [],
  "provenance": {
    "source": "cli",
    "workflow": {
      "name": "Build",
      "run_id": 0
    }
  },
  "repo": {
    "id": 1055826069,
    "name": "a5c",
    "full_name": "a5c-ai/a5c",
    "private": true
  },
  "ref": {
    "name": "a5c/main",
    "type": "branch",
    "sha": "<sha>"
  },
  "actor": {
    "id": 221166651,
    "login": "a5c-ai[bot]",
    "type": "Bot"
  }
}
