{
  "id": "example-123",
  "provider": "github",
  "type": "pull_request",
  "occurred_at": "2025-01-01T00:00:00.000Z",
  "repo": {
    "id": 0,
    "name": "example",
    "full_name": "a5c-ai/example",
    "private": false,
    "visibility": "public"
  },
  "actor": {
    "id": 0,
    "login": "example",
    "type": "User"
  },
  "payload": {
    "pull_request": {
      "id": 1,
      "number": 1,
      "title": "Example PR",
      "body": "Example",
      "draft": false
    },
    "repository": {
      "full_name": "a5c-ai/example"
    }
  },
  "provenance": {
    "source": "cli"
  },
  "labels": [],
  "enriched": {
    "github": {
      "provider": "github",
      "partial": true,
      "reason": "flag:not_set"
    }
  }
}
