{
  "id": "62",
  "provider": "github",
  "type": "pull_request",
  "occurred_at": "<iso-8601>",
  "payload": {
    "action": "synchronize",
    "number": 62,
    "pull_request": {
      "number": 62,
      "state": "open",
      "title": "ðŸ§ª Samples and fixtures for GitHub events (issue #48)",
      "draft": true,
      "mergeable_state": "dirty",
      "base": {
        "ref": "a5c/main",
        "sha": "<sha>"
      },
      "head": {
        "ref": "feat/samples-fixtures-issue48",
        "sha": "<sha>"
      },
      "labels": [
        {
          "name": "documentation"
        },
        {
          "name": "producer"
        },
        {
          "name": "testing"
        }
      ],
      "user": {
        "login": "developer-agent",
        "type": "Bot"
      },
      "html_url": "https://github.com/a5c-ai/events/pull/62"
    },
    "repository": {
      "id": 1055826069,
      "name": "events",
      "full_name": "a5c-ai/events",
      "private": true
    },
    "sender": {
      "login": "tmuskal",
      "type": "User",
      "id": 1934369
    }
  },
  "labels": [],
  "provenance": {
    "source": "cli"
  },
  "repo": {
    "id": 1055826069,
    "name": "events",
    "full_name": "a5c-ai/events",
    "private": true
  },
  "ref": {
    "name": "feat/samples-fixtures-issue48",
    "type": "pr",
    "head": "feat/samples-fixtures-issue48",
    "base": "a5c/main"
  },
  "actor": {
    "id": 1934369,
    "login": "tmuskal",
    "type": "User"
  }
}
