{
  "id": "2222222222222222222222222222222222222222",
  "provider": "github",
  "type": "push",
  "occurred_at": "2025-09-14T00:44:06.716Z",
  "payload": {
    "ref": "refs/heads/a5c/main",
    "before": "1111111111111111111111111111111111111111",
    "after": "2222222222222222222222222222222222222222",
    "repository": {
      "id": 1055826069,
      "name": "events",
      "full_name": "a5c-ai/events",
      "private": true
    },
    "pusher": {
      "name": "a5c-ai[bot]",
      "email": "agent@a5c.ai"
    },
    "sender": {
      "login": "a5c-ai[bot]",
      "type": "Bot",
      "id": 221166651
    },
    "created": false,
    "deleted": false,
    "forced": false,
    "commits": [
      {
        "id": "2222222222222222222222222222222222222222",
        "message": "chore: update docs",
        "timestamp": "2025-09-13T10:45:00Z",
        "author": "REDACTED"
      },
      {
        "id": "3333333333333333333333333333333333333333",
        "message": "feat: add samples @developer-agent",
        "timestamp": "2025-09-13T10:46:00Z",
        "author": "REDACTED"
      },
      {
        "id": "4444444444444444444444444444444444444444",
        "message": "fix: CI tweaks",
        "timestamp": "2025-09-13T10:47:00Z",
        "author": "REDACTED"
      }
    ],
    "head_commit": {
      "id": "2222222222222222222222222222222222222222",
      "message": "chore: update docs"
    }
  },
  "labels": [],
  "provenance": {
    "source": "cli"
  },
  "repo": {
    "id": 1055826069,
    "name": "events",
    "full_name": "a5c-ai/events",
    "private": true
  },
  "ref": {
    "name": "a5c/main",
    "type": "branch",
    "sha": "2222222222222222222222222222222222222222"
  },
  "actor": {
    "id": 221166651,
    "login": "a5c-ai[bot]",
    "type": "Bot"
  }
}
