{
  "id": "evt-123",
  "provider": "github",
  "type": "pull_request",
  "occurred_at": "2025-09-15T12:00:00Z",
  "repo": {
    "id": 1055826069,
    "name": "events",
    "full_name": "a5c-ai/events",
    "private": true
  },
  "actor": { "id": 221166651, "login": "a5c-ai[bot]", "type": "Bot" },
  "payload": { "pull_request": { "number": 567, "title": "Update docs" } },
  "provenance": { "source": "cli" },
  "labels": ["docs", "example"],
  "enriched": {
    "github": {
      "provider": "github",
      "partial": true,
      "reason": "flag:not_set"
    }
  }
}
